{
  "id": 19,
  "slug": "paradigmas-avancados-algoritmos",
  "badge": "Módulo 19 · Especialização Avançada",
  "nivel": "Especialista",
  "titulo": "Paradigmas Avançados: Divisão & Conquista, Programação Dinâmica e Gulosos",
  "subtitulo": "Subestrutura ótima, subproblemas sobrepostos, Memoization (Top-Down) vs Tabulação (Bottom-Up) e Matróides.",
  "objetivo": "Dominar os 4 grandes paradigmas de projeto de algoritmos: Divisão e Conquista, Programação Dinâmica (DP), Algoritmos Gulosos (Greedy) e Backtracking com Poda.",
  "introducaoIntuitiva": "Se você calcula o caminho mais curto de São Paulo ao Rio passando por Resende, o subtrecho de Resende ao Rio obrigatoriamente também deve ser o caminho mais curto possível entre essas duas cidades. Essa propriedade fundamental é a Subestrutura Ótima.",
  "explicacaoAprofundada": "1. DIVISÃO E CONQUISTA: Divide o problema em subproblemas DISJUNTOS, resolve recursivamente e combina os resultados (ex: MergeSort, QuickSort, Multiplicação de Strassen).\n2. PROGRAMAÇÃO DINÂMICA (Richard Bellman): Aplicável quando o problema possui duas propriedades: (a) Subestrutura Ótima (a solução ótima contém soluções ótimas para os subproblemas) e (b) Subproblemas Sobrepostos (os mesmos subproblemas são resolvidos repetidas vezes). Técnicas: Memoization (Top-Down com tabela/cache de resultados) e Tabulação (Bottom-Up preenchendo matrizes iterativamente).\n3. ALGORITMOS GULOSOS (Greedy): Fazem a escolha localmente ótima a cada passo esperando alcançar o ótimo global. Requerem a Propriedade da Escolha Gulosa (demonstrável via Teoria dos Matróides de Whitney). Se falhar, DP é necessária.\n4. BACKTRACKING & BRANCH-AND-BOUND: Exploração sistemática do espaço de estados em árvore com Poda (Pruning) precoce de ramos que violam restrições.",
  "exemplos": {
    "basico": {
      "titulo": "Fibonacci: Recursão Ingênua O(2^n) vs DP Tabulada O(n)",
      "descricao": "Fibonacci ingênuo recalcula Fib(3) dezenas de vezes. Com DP Tabulada: tabela[0]=0, tabela[1]=1; PARA i=2..n: tabela[i]=tabela[i-1]+tabela[i-2]. Custo reduzido de exponencial para linear!"
    },
    "intermediario": {
      "titulo": "O Problema da Mochila 0/1 (Knapsack Problem)",
      "descricao": "Itens com peso e valor. Abordagem gulosa (pegar maior valor/peso) falha. A solução exata exige Programação Dinâmica com matriz DP[i][w] = max(DP[i-1][w], DP[i-1][w-peso[i]] + valor[i])."
    },
    "avancado": {
      "titulo": "Algoritmo de Huffman (Guloso Ótimo)",
      "descricao": "Compressão de dados usando Árvore de Huffman. A propriedade gulosa de unir sempre os dois nós de menor frequência produz comprovadamente a árvore de codificação ótima com comprimento médio mínimo de bits."
    }
  },
  "passoAPasso": [
    "1. Analisar se o problema possui Subestrutura Ótima (a solução ótima é composta por ótimos menores).",
    "2. Verificar se os subproblemas são disjuntos (usar Divisão e Conquista) ou sobrepostos (usar Programação Dinâmica).",
    "3. Se for DP, formular a Equação de Recorrência de Bellman de transição de estados.",
    "4. Escolher entre Memoization (Top-Down recursivo com cache) ou Tabulação (Bottom-Up com matriz).",
    "5. Se for tentar abordagem Gulosa, PROVAR matematicamente que a escolha gulosa local nunca perde o ótimo global."
  ],
  "errosComuns": [
    {
      "erro": "Usar algoritmo guloso sem provar a propriedade da escolha gulosa",
      "correcao": "Muitos problemas (como Mochila 0/1 ou Troco com moedas arbitrárias) exigem DP pois o guloso fica preso em ótimos locais."
    },
    {
      "erro": "Recursão ingênua sem memoization em subproblemas sobrepostos",
      "correcao": "Gera explosão combinatória O(2^n); sempre armazene estados já computados."
    }
  ],
  "comparacaoSolucoes": {
    "boa": "Programação Dinâmica estruturada com matriz de estados e complexidade polinomial garantida.",
    "ruim": "Força bruta exponencial O(2^n) recalculando subestados idênticos repetidamente."
  },
  "pseudocodigo": "// Programação Dinâmica Bottom-Up: Troco Mínimo de Moedas\nFUNÇÃO troco_minimo_dp(moedas, valor_alvo)\n    CRIAR VETOR dp[0 .. valor_alvo] COM VALOR INFINITO\n    dp[0] <- 0 // Caso base: 0 moedas para valor 0\n    \n    PARA v DE 1 ATÉ valor_alvo FAÇA\n        PARA CADA m EM moedas FAÇA\n            SE m <= v ENTÃO\n                dp[v] <- MINIMO(dp[v], dp[v - m] + 1)\n            FIM_SE\n        FIM_PARA\n    FIM_PARA\n    RETORNAR dp[valor_alvo]\nFIM_FUNÇÃO",
  "traceData": [
    {
      "passo": 1,
      "acao": "Inicializar dp[0]=0, dp[1..6]=INF",
      "estado": "moedas = [1, 3, 4]",
      "obs": "Tabela Bottom-Up"
    },
    {
      "passo": 2,
      "acao": "Calcular dp[1] a dp[4]",
      "estado": "dp[1]=1, dp[3]=1, dp[4]=1",
      "obs": "Valores base"
    },
    {
      "passo": 3,
      "acao": "Calcular dp[6]",
      "estado": "dp[6] = dp[3] + 1 = 2 (duas moedas de 3)",
      "obs": "Superou guloso (4+1+1=3 moedas)!"
    }
  ],
  "exercicios": [
    {
      "id": "ex19_1",
      "tipo": "multipla_escolha",
      "enunciado": "Quais são as duas propriedades obrigatórias que um problema deve possuir para que a Programação Dinâmica (DP) seja a estratégia correta de solução?",
      "opcoes": [
        "Subestrutura Ótima e Subproblemas Sobrepostos",
        "Ordenação Prévia e Complexidade Constante",
        "Finitude e Recursão de Cauda",
        "Aleatoriedade e Busca Binária"
      ],
      "correta": 0,
      "pista": "A solução ótima deve ser construída a partir de ótimos menores, e os mesmos subproblemas devem se repetir ao longo da árvore de decisão.",
      "justificativa": "A Programação Dinâmica exige Subestrutura Ótima (para garantir a corretude da composição) e Subproblemas Sobrepostos (para justificar o uso de cache/tabela e evitar recalcular)."
    }
  ],
  "perguntasVerificacao": "Qual a diferença conceitual e de consumo de memória entre Memoization (Top-Down) e Tabulação (Bottom-Up)?",
  "keywordsIA": [
    "programacao_dinamica",
    "subestrutura_otima",
    "subproblemas_sobrepostos",
    "memoization",
    "tabulacao",
    "guloso",
    "greedy",
    "backtracking",
    "bellman"
  ],
  "misconceptionsIA": [
    {
      "termo": "guloso_sempre",
      "erro": "Achar que algoritmos gulosos sempre encontram a melhor solução",
      "explicacao": "Gulosos só funcionam quando a escolha local não compromete escolhas futuras (propriedade de matróide)."
    }
  ],
  "explicacaoIdealIA": "Programação Dinâmica resolve problemas com subestrutura ótima e subproblemas sobrepostos através de memoization ou tabulação. Algoritmos Gulosos fazem escolhas locais irreversíveis e exigem prova formal de otimalidade."
}
